Title,Link,Excerpt,Content
Extra baggage,https://www.dawn.com/news/1831997/extra-baggage,A bloated government workforce is hindering progress.,"UNDISPUTEDLY, the most important, most versatile and most indispensable person in a government office is the naib qasid, often the only moving component of an inert piece of machinery. He is the critical hub, an integral element of a governance system designed for a colonial era. He not only knows the location but also the contents of files and papers that drive and define a government. Naib qasids carry files from one office to another, perform housekeeping, ask visitors to wait, serve tea to their masters, and search, shelve, lose, find, misplace or retrieve files and records — depending upon their mood and motivation. Using the ‘right to information’ law, our research, which is spread over a sample of 15 well-known and highly esteemed government organisations, such as National Savings, the Benazir Income Support Programme, the Employees’ Old-Age Benefits Institution (EOBI), the Supreme Court and the Wafaqi Mohtasib, yields startling results. First, 23 per cent of the entire government of Pakistan consists of just one category of individuals — often called ‘qasids’, ‘naib qasids’ or ‘daftaris’. As per the data provided under the right to information law, the Supreme Court (SC) tops this list with 283 (34pc) qasids and naib qasids, out of a total of 833 regular and contingent employees. Another prominent mention is BISP, that employs 473 qasids out of a total of 2,356 employees. Such governance through naib qasids would be inconceivable in any developed country, where officials must perform their own chores. The study gets yet more overwhelming as it reveals that the employees designated as upper division clerks, lower division clerks or steno typists constitute 26.8pc of the entire government of Pakistan. Although most offices have acquired computers and most senior officers have obtained laptops (at taxpayers’ expense), there is no let-up in the demand or number of UDCs and LDCs. One wonders why emails, used by the rest of the world for the last 30 years, are still not an accepted form of official correspondence. Have low skills and high status become our biggest hindrance to progress? Should the conditions of employment not specify that every bureaucrat must carry his own briefcase, drive his own (private) car, clean his own table, receive, respond and file his own mail electronically, make his own tea, etc? The next mind-boggling segment of employees — 22.7pc of government— sadly comprises chowkidars and private security guards. National Savings, with 1,270 security guards, champions this class, followed by Pakistan Post’s 754 guards and BISP’s 386 chowkidars. There is also no guilt for cruelty on the part of our esteemed organisations who engage guards through private security companies, not registering them with the EOBI and paying them less than half the minimum legal wage for performing 12-hour duty each day. A bloated government workforce is hindering progress. From this, we can conclude that 72.5pc of the entire government of Pakistan consists of three categories of employees: qasids/ naib qasids, UDCs/ LDCs, and guards/ chowkidars. Like ministers, many are inducted on considerations of ‘relative’, ‘friend’, ‘party’, ‘clan’, etc. Must we not ponder why Pakistan Railways operates with 315 employees per train, as opposed to the Indian Railways’ 53, and Japan Railway’s 5.9? Why does the SC operate with 833 employees and its British counterpart with 64 employees for around the same number of judges? It is time to admit that only by shedding 70pc of our government workforce will Pakistan see progress. There are at least two main approaches to reducing the size of this mountain — firstly, by using te­­chnology to perfo­rm all those functions that can enhance efficiency and convenience. National Savings’ latest software, which req­ui­res no citizen to visit a savings centre and to automatically re­­ceive profits in a designated bank, is a brilliant example. Resultantly, National Savings can potentially cut down 70pc of its employees and branches. The other approach is to eliminate all that is redundant or ceremonial. Almost all commissions and bureaus (NCHR, NCRC, NCSW, etc.) can be closed and their functions performed by their parent ministries. Numerous ministries such as health, human rights, religious affairs and overseas Pakistanis could be merged and renamed the ‘Ministry for Health & Population’. In this manner, Pakistan could reduce the total number of ministries (and logically the ministers) from 32 to 10. These two approaches ought to be identically emulated by the defence services as well as the provincial governments. Our governance system is dysfunctional and bloated. It exists only to preserve the luxuries of an extractive class. Its dismantling is a prerequisite for the progress of Pakistan. The writer is an industrial engineer and a volunteer social activist. naeemsadiq@gmail.com Published in Dawn, May 7th, 2024"
Nepra approves Rs2.83 per unit hike in FCA for May power bills,https://www.dawn.com/news/1832270/nepra-approves-rs283-per-unit-hike-in-fca-for-may-power-bills,,"The National Electric Power Regulatory Authority (Nepra) on Wednesday authorised ex-Wapda distribution companies (XWDiscos) to levy a Rs2.83 per unit charge in consumers’ electricity bills for May as part of fuel cost adjustment (FCA) charges. Nepra said the FCA pertains to the month of March. According to anotificationissued by Nepra, a copy of which is available withDawn.com, the new adjustment “shall be applicable to all the consumer categories except Electric Vehicle Charging Stations (EVCS) and lifeline consumers”. The notification added that this adjustment would be shown in consumers’ bills based on units billed in March. Last month, the government hadsought clearancefrom Nepra to extract about Rs23 billion additional in FCA  from consumers for electricity consumed in March despite 79 per cent of power generation coming from cheaper local fuels. The Central Power Purchasing Agency (CPPA) — a subsidiary of the Power Division — had demanded Rs2.94 per unit additional fuel cost to recover from consumers through May bills. The proposed additional FCA was almost 46pc higher than the pre-fixed fuel cost of Rs6.44 per unit already charged to consumers in March. This raised questions about the power sector bureaucracy’s capabilities to forecast fuel costs even for six to seven months. In recent months, the additional FCAs have ranged between 50 and 115pc higher than the pre-determined fuel costs notified at the start of the current fiscal year. This FCA was on top of about a 26pc increase in the annual base tariff and another 10pc hike under the quarterly tariff adjustment currently in place and being charged to consumers at Rs2.75 per unit. As a result, consumers continue to pay excessive bills despite lower consumption patterns. Nepra had accepted the request for a public hearing on April 26. The higher proposed FCA for March is apparently mainly due to higher domestic coal and gas prices, although the use of imported fuels like coal, diesel and furnace oil remained zero. LNG was relatively cheaper, and the exchange rate remained stable. In a petition, the CPPA, acting as commercial agent of Discos, demanded an additional FCA of Rs2.94 per unit in the May bills for electricity consumed in March. It claimed that the reference fuel cost for March was Rs6.44 per unit, but the actual fuel cost rose to Rs9.38 per unit. The average fuel cost in February also stood at about Rs9.42 per unit. It said about 8,023-gigawatt-hour (GWh) of electricity was generated at an estimated fuel expenditure of Rs66.7bn (Rs8.3 per unit) in March, of which 7,756 GWh energy was delivered to Discos at the cost of Rs72.67bn (at Rs9.38 per unit). The data showed declining consumption trends. The consumption in March was also 8.3pc lower than the same month (8,459Gwh) last year. The Rs2.94 per unit FCA for March sought this year was more than double the Rs1.17 per unit FCA of the same month last year. In the April 26 hearing, Nepra hadcriticisedthe power companies for inefficiencies and the use of expensive power plants despite the availability of cheaper sources but had hinted at allowing them to charge another Rs22.8bn to consumers in the billing month of May."
PM Shehbaz orders formation of Pakistan Skill Company to train overseas Pakistanis,https://www.dawn.com/news/1832262/pm-shehbaz-orders-formation-of-pakistan-skill-company-to-train-overseas-pakistanis,,"Prime Minister Shehbaz Sharif on Wednesday ordered the establishment the Pakistan Skill Company and Pakistan Skill Development Fund to unify technical and vocational education countrywide and provide better employment to the country’s workers abroad. The prime minister, chairing a high-level meeting reviewing the matters of the Ministry of Overseas Pakistanis and Human Resource Development and National Vocational and Technical Training Commission (NAVTTC), decided to introduce reforms within both organisations. Shehbaz also ordered the immediate establishment of the Pakistan Skill Development Fund, according to a federal government post on X. The premier said NAVTTC should be further enhanced to provide world-class technical and vocational training to the young workforce abroad. He added that “globally renowned and international certifications should be ensured in all fields”.  The prime minister emphasised the importance of greater cooperation between the federal institutions, adding that the “technical training plan should be implemented in line with international standards”. Similarly, he stressed collaboration between the centre and provinces to elevate the quality of Pakistan’s technical manpower and human resource development. He also called for a coordinated and organised database of Pakistani workers in collaboration with Nadra, NAVTTC and provincial institutions, and the establishment of an integrated system to regulate manpower equipped with world-class professional technical skills. Stressing the need for implementing the technical and vocational training plans, the prime minister also ordered reforms to the licensing regime of companies employing skilled Pakistanis abroad. PM Shehbaz said individuals and companies involved in defrauding the people and inflicting financial losses should be identified. He instructed authorities to ensure meritocracy and transparency in the posting of community welfare attaches in Pakistani missions abroad. The prime minister was briefed about the steps taken by NAVTTC regarding the vocational and technical training of the workforce in Pakistan. He was told that NAVTTC would provide vocational and technical training to 60,000 people in 2024, while the figure would rise to 0.6 million in the next three years following the reforms. The meeting’s participants were told that the exchange of information about employment opportunities and required skills from foreign countries was being ensured and that data on manpower consumption was also being obtained from local industries. They were also told that NAVTTC had made the certification of male and female students from internationally renowned institutes mandatory to maintain international vocational and technical training standards."
Saudi Crown Prince MBS expected to arrive within days to seal investment deals,https://www.dawn.com/news/1832202/saudi-crown-prince-mbs-expected-to-arrive-within-days-to-seal-investment-deals,,"• Dar terms talks with Saudi investors’ delegation ‘elaborate’• FM explains did not sanction wheat import as ECC head, reiterates Islamabad won’t take dictation on Pakistan-Iran gas pipeline project ISLAMABAD: Against a flurry of activities between Pakistan and Saudi Arabia to boost trade ties, Crown Prince Mohammed Bin Salman is expected to arrive in Pakistan this month toconcludedeals being negotiated between Islamabad and Riyadh. According to Foreign Minister Ishaq Dar, dates for the visit had not been communicated to Pakistan, but media reports claimed that the visit was likely on May 10-15. “The crown prince had accepted Prime Minister Shehbaz Sharif’s invitation. The visit is on the cards, but no dates have been communicated to us as yet,” FM Darsaidat a briefing on his participation in the World Economic Forum (WEF) in Saudi Arabia and Organisation of Islamic Cooperation meetings in Gambia. He explained that the initial understanding was for discussions to commence at the government level after MBS committed toinvest $5 billion in Pakistan, followed by subsequent talks between business executives. Saudi Foreign Minister Faisal bin Farhan Al Saud led a ministerial delegation to Islamabad on April 15-16. Later, FM Dar and PM Shehbaz held meetings with Saudi leadership on the sidelines of the WEF and over the past few days a delegation of Saudi businessmen led by the Saudi deputy minister for investment visited Islamabad. FM Dar said discussions with the Saudi business executives were “elaborate and the group left very impressed” with the way Pakistan was proceeding on the issue. He said large projects like Reko Diq and petrochemicals would be undertaken at the government level, but the private sector would collaborate on increasing trade volume and joint ventures. Pak-Iran gas pipeline Speaking about the long-stalled project, the foreign minister said Islamabad would decide on this issue in light of its national interest and commitments it had made. Referring to theexternal pressure, especially from the US, the minister said, “We can’t allow anyone to dictate to us or use the veto.” He said Pakistan expected other countries to respect its sovereignty, much like it respected theirs. At the conclusion of the Iranian president’s visit to Pakistan last month, both countries called for closer cooperation in the energy sector and the gas pipeline was mentioned as one of the projects. Both sides, however, did not say how they planned to move ahead in light of the US sanctions against Iran. Furthermore, Ishaq Dar said he would visit China on a three-day trip from May 13 to May 15 for the strategic dialogue with his Chinese counterpart Wang Yi. This would be the foreign minister’s first visit to Beijing after the installation of the new government. His visit is likely to be preceded by Planning Minister Ahsan Iqbal’s trip to China. About the currentwheat crisis, Ishaq Dar clarified that during the last tenure of the PML-N government, which ended last August, he did not approve a summary for the import of wheat that had been presented to him. He was the head of the of the Economic Coordination Committee. “The relevant ministry could not satisfy me about the need for importing wheat,” he said while clarifying his decision on not approving the summary. PTI-US envoy meeting The foreign minister confirmed that the Foreign Office had facilitated ameetingbetween US envoy Donald Blome and Opposition Leader Omar Ayub at the request of the US embassy. This was part of a broader series of engagements that the US embassy sought with various Pakistani political figures, both from the government and opposition, in March. This was part of a broader series of engagements that the US embassy sought with various Pakistani political figures, both from the government and opposition, in March. “It was the initiative of the US envoy,” Mr Dar emphasised. The PTI was chided by its opponents for engaging with the US envoy, given its past allegations that the US conspired to oust PTI leader Imran Khan as prime minister. The party, however, clarified that the meeting was facilitated by the FO and not sought by the PTI. Published in Dawn, May 8th, 2024"
"Economic Coordination Committee approves 400,000 tonnes increase in wheat procurement target",https://www.dawn.com/news/1832130/economic-coordination-committee-approves-400000-tonnes-increase-in-wheat-procurement-target,,"ISLAMABAD: The Economic Coordination Committee (ECC) of the cabinet on Tuesday approved 400,000 tonnes of additional wheat procurement by the Centre, allowed the import of 200,000 tonnes of urea, and sanctioned about Rs144 billion in supplementary grants. However, the ECC meeting, presided over by Finance Minister Muhammad Aurangzeb, did not immediately allow the supply of subsidised gas to domestic urea manufacturers. According to relevant ministries, this could have facilitated about 600,000 tonnes of local production — about 445,000 tonnes in Punjab and 165,000 tonnes in Sindh.  An official statement said the ECC approved an increase in the wheat procurement target for Passco — the national agency that maintains strategic food stocks — from 1.4 million to 1.8 million tonnes, along with the required cash credit limit (about Rs41.5bn) to purchase additional quantity. The approval would help Passco scale up its ongoing wheat procurement drive. The prime minister had already announced that Passco, a federal entity, would purchase an additional 400,000 tonnes from farmers after the Punjab government did not intervene amid raging farmers’ anger. Allows import of 200,000 tonnes of urea, okays Rs144bn in grants The ECC also approved the import of 200,000 tonnes of urea fertiliser to meet the requirements for the 2024 kharif season as proposed by the Ministry of Industries and Production, the statement said. The ministry was also directed to continuously assess the urea demand and supply situation and suggest appropriate measures to the ECC in a timely manner. The committee also approved the Ministry of Industries and Production’s request to disburse salaries of Pakistan Steel Mills workers for six months (January to June 2024) and directed the ministry to present a detailed plan and timeline for the future use of the PSM assets. The ECC also allowed apower division’s requestto release budgeted expenditures to clear the arrears of tariff differential subsidy of Rs70bn for K-Electric and Rs55bn for Azad Jammu and Kashmir. This would help ease the power sector’s liquidity requirements. The ECC also authorised the BISP cash transfer programme to arrange funds from its allocated budget for financing the Special Relief Package for Daily Wage Workers on the Chaman Border, highlighting government support for the vulnerable group. The committee also approved supplementary grants, including Rs4.8bn for the Pakistan Atomic Energy Commission, Rs5.8bn for the erstwhile Earthquake Reconstruction and Rehabilitation Authority to clear matured liabilities of the contractors, and Rs3.2bn to the finance division as rupee cover for the World Bank-funded Financial Inclusion and Infrastructure Project (FIIP). Moreover, the ECC approved a Rs162m grant for the Ministry of Housing and Works to repair and maintain public buildings in Islamabad, and Rs2.2bn for the Ministry of Interior to rehabilitate ex-Fata’s temporary displaced persons. Published in Dawn, May 8th, 2024"
"PM orders action over ‘ineffective’ track, trace system",https://www.dawn.com/news/1832117/pm-orders-action-over-ineffective-track-trace-system,,"ISLAMABAD: Prime Minister Sheh­baz Sharif on Tuesday ordered stern action against the Federal Board of Revenue (FBR) officials, including its former chairman, allegedly involved in the installation of an ‘ineffective’ track and trace system (TTS) in various industries,causing lossesto the tune of billions of rupees through tax evasion and smuggling. The decision to proceed against tax officials was made in light of an inquiry report submitted to the prime minister during a meeting about the FBR. The report was prepared by a five-member committee headed by former fina­nce secretary Tariq Bajwa. “The FBR chairman working during that tenure (when the TTS was introduced) was also held responsible for the poor administrative supervision,” said a press release. It may be noted Dr Muhammad Ashfaq Ahmed was serving as the FBR chief when the track and trace system was installed to monitor production in cigarette, fertilisers, sugar, and cement industries. It also aimed to identify counterfeit products and end smuggling. 20-member delegation from Japanese firms to arrive soon PM Shehbaz said that due to “faulty” planning and the negligence in its enforcement, the economy suffered. He asked why certain important provisions were neglected regarding the enforcement of the significant national project. According to the inquiry report, the project director and the member operations inland were found “guilty of neglect”. The report also fixed primary responsibility on the subsequent officials working on those posts. Saudi investment PM Shehbaz also chaired a cabinet meeting which largely focused on the potential Saudi investments, with the premier saying the visit of the Sau­di investors to Islam­abad was a “significant headway” in the ties between Islamabad and Riyadh. The cabinet also allo­w­­ed Air Sial to start its fli­g­­ht operations to China, Ma­­laysia, Sri Lanka, Thai­land, Turkiye, the UK, and Kuwait under the Nat­ional Aviation Policy 2023 and Air Services Agreement. It gave a nod to an MoU [memorandum of understanding] for the formation of a joint trade committee between Pakistan and Cambodia. The meeting also appro­ved the transfer of the Dire­ctorate General of Special Education from the hu­­man rights ministry to the education ministry. It also endorsed the decisions of the cabinet committee regarding the Chinese investment projects taken on April 30, 2024. Electric cars In a separate meeting, Prime Minister Sharif was apprised that Japanese companies have started spadework to produce hybrid cars locally. The prime minister, in the meeting with a delegation of Japanese companies and business figures in Pakistan led by Japa­nese Ambassador Wada Mitsuhiro, said a committee had been formed to resolve the issues confronting the Japa­n­ese firms to promote their business activities in the country. He said it was high time for both countries to promote trade and investment ties across multiple sectors. The delegation members expressed confidence in the government’s pro-business policies and mea­sures to promote investment, said a statement. The Japa­nese ambassador apprised the PM of the upcoming visit of a 20-member delegation from Japanese firms which would prove to be a milestone in enhan­cing the trade. Published in Dawn, May 8th, 2024"
Ex-PM Kakar denies blaming provinces for wheat import,https://www.dawn.com/news/1832200/ex-pm-kakar-denies-blaming-provinces-for-wheat-import,,"QUETTA: As the wheat import scandal refuses to die down, former caretaker prime minister Anwarul Haq Kakar has said he never blamed the provinces for the excessive import of the grain, alleging that the media is circulating false news about him. Speaking at a press conference here on Tuesday, Mr Kakar said the Food Security and Research Department was informed about the expected wheat production in the country for which a procedure was devised. In response to media questions, the former premier, who was accompanied by federal Interior Minister Mohsin Naqvi and Balochistan Chief Minister Mir Sarfaraz Bugti, accused the media of twisting his statement. Mr Kakar was referring to media reports suggesting that he blamed provincial governments for seeking import of additional wheat. According to aDawnreport, around 3.2 million tonnes of wheat was imported between Septe­mber 2023 and March 2024, while the local crop hit the market in April. The ex-PM said the decision to import the commodity was taken as per data of the Food Security Department. “The [caretaker] government planned to import wheat, allowing the private sector to do so. A summary regarding the wheat requirement was also sent, and wheat importation adhered to rules and regulations,” he added. Mr Kakar recalled that before the 18th Amen­dment, the responsibility for wheat production and national requirements, including import and export, was with the federal government. After the 18th Amendment, he added, the provinces make demands about export and import requirements of wheat. “Because our country needs approximately 27 million tonnes of wheat, facing a shortage of approximately 4m tonnes, discussions should be held to fulfil this shortage so that production can be increased and a solution to this issue can be found,” he said. Floodlights in cricket stadium Speaking on the occasion, Interior Minister Naqvi said floodlights would be installed at Nawab Bugti cricket stadium within three months in order to promote cricket in Balochistan. “PCB will fulfil its promise to install floodlights by September. PSL matches will also arranged in Quetta after making the stadium up to the mark,” said Mr Naqvi, who is also chairman of the Pakistan Cricket Board. He said the PCB would also play its role in the promotion of cricket in Gwadar and Quetta. Chief Minister Bugti thanked the interior minister for the announcement to install floodlights at the stadium in Quetta. Replying to a question about the prolonged protest in Chaman, he said the federal government had decided to impose a one-document system for crossing the Pak-Afghan border, adding that the government would not allow anyone to cross the border without passport and visa. Published in Dawn, May 8th, 2024"
