Title,Link,Excerpt,Content
Fistula and child marriages: The two epidemics plaguing women in Gilgit-Baltistan,https://www.dawn.com/news/1823323/fistula-and-child-marriages-the-two-epidemics-plaguing-women-in-gilgit-baltistan,,"Seema, a resident of Astore District of Gilgit-Baltistan, received the title, ‘Woman of the Year’, not for her achievements, but for a fate imposed upon her at a tender age: child marriage. One can’t help but wonder how entering into a marriage contract at a tender age warrants this title. Visibly upset, Seema recounted her story, explaining why she received the honour. Married at the tender age of 13 and diagnosed with vaginal fistula when she was 16 years old, Seema’s existence has since become synonymous with agony. Every villager, out of pity for her deteriorating health, would visit her, oblivious to the struggle she bore in silence. With no funds for treatment, her father-in-law had even asked the doctor to give her poison — a desperate plea for relief. Before delving further into Seema’s story, it is important to understand whatvaginal fistulais. The condition occurs when an abnormal passage is created between the vagina and neighbouring pelvic organs like the bladder or rectum. This can lead to numerous complications, including urinary and faecal leakage, abnormal vaginal discharge, tissue damage, kidney infections, and various other symptoms. Doctors warn that untreated fistulas can escalate to reproductive system cancers, potentially even leading to death. Seema described the pain to be so agonising that she wished for a quick death on several occasions. It’s a stark contrast to the dreams that typically fill the heart of a 16-year-old girl — dreams of a future adorned with aspirations and possibilities. However, Seema found herself teetering on the precipice of despair, grappling with the grim reality of her life-long disease. It only makes sense for her to be called the ‘Woman of the Year,’ doesn’t it? Her journey isn’t merely reflective of the far-reaching consequences of fistula but is also a testament to the devastating consequences of child marriage. According to aUnicef reportan estimated 18 per cent of young girls are wed before reaching adulthood [18 years of age], amounting to almost 19 million child brides in the country. The number of unreported instances is believed to be even higher. As per theNational Commission on the Rights of Child (NCRC), Pakistan has the sixth highest number of women married before the age of 18 in the world. Theadverse impacts of early marriageare manifold, encompassing the deteriorating health of the young bride, high-risk pregnancy, and impediments to both her education and personal growth. Moreover, in developing countries such as Pakistan, the unregulated cycle of childbirth places a heavy financial strain on parents, as they struggle to support multiple children, ultimately perpetuating poverty within these families. Despite tireless global campaigns and legal enforcement in these countries, the insidious practice of child marriage persists. This prevalence is fuelled by a glaring lack of awareness regarding the severe repercussions of such unions, amplifying the issue. The plight of girls under 18 is particularly dire, as depicted in Seema’s case. Her story serves as a stark reminder of the health complications faced by these young brides face. From debilitating conditions like fistula to a myriad of other ailments, many women are condemned to a lifetime of anguish. While some manage to recover through treatment, others suffer without ever experiencing improvement in their health. Dr Sajjad Ahmed, who offers free treatment to patients atKoohi Goth Hospitalin Karachi, said that a significant number of women travel long distances from remote areas to seek treatment at the hospital located in the port city’s Bin Qasim Town. This reality underscores the inadequacy of basic facilities accessible to women in Pakistan. At the other end of the country, Dr Sher Shah and his dedicated team annually organise medical camps in Gilgit, offering treatment and performing surgeries for fistula patients free of cost. While minor cases receive care at City Hospital Gilgit, those requiring more intensive procedures are referred to Koohi Goth Hospital in Karachi. Dr Sher Shah mentioned how the hospital serves patients not only from across the country but also extends care to individuals from Afghanistan, Iran, Sharjah, and Yemen. Drawing patients from the farthest corners of Sindh, Punjab, Chitral, and Gilgit-Baltistan, including the remote locales of Skardu, Diamir, and Ghizar, individuals recover under their expertise. The hospital has provided free surgeries to almost 40 patients from Gilgit-Baltistan alone. Despite the invaluable services rendered, the absence of more specialised hospitals for the condition remains a gap in the country’s healthcare infrastructure, he added. Dr Nazneen Zamir Farooqi, a gynaecologist at City Hospital Gilgit, gets patients from remote areas of Gilgit-Baltistan, including Diamer, Astor, Skardu, Kharmang, Darel, and Ghizar. In many of these regions, the scarcity of healthcare facilities and the absence of skilled attendants during childbirth worsen the problem. “The pervasive practice of child marriage significantly contributes to this crisis. When young girls are married off, their bodies are ill-equipped for childbirth — a biological reality — as physical maturity is typically achieved post-puberty,” she explained. Consequently, girls under 18 years face heightened risks of complications, and if they contract fistula, their suffering is only magnified. Throughout pregnancy and childbirth, the absence of adequate treatment can result in a spectrum of deformities in women’s bodies, often leading to the onset of debilitating diseases. Among these, fistula stands out as one of the most distressing, inflicting not only physical discomfort but also profound psychological and social ramifications. Girls married off at a young age have underdeveloped bodies and fragile bones. If they undergo childbirth before their bodies have fully matured, they are at risk of developing fistula. Similarly, older women who have borne numerous children may experience weakened muscles, rendering them incapable of delivering the baby during childbirth. In some cases, it may also lead them to develop this condition. In both scenarios, giving birth to a child becomes an excruciating process for the woman, wherein the pressure exerted by the baby’s head against the muscles between the bladder and the vagina may result in the formation of a fistula. In many cases, the babies are stillborn. Without immediate medical intervention, the affected woman is condemned to endure the pain. TheChild Marriage Restraint Act of 1929, a federal law in Pakistan in alignment with international conventions on children’s rights, unequivocally condemns a marriage involving a girl under 16 years of age and a boy under 18 years of age as a violation of fundamental rights. Although each province in Pakistan has established its own regulations, in the absence of specific provincial guidelines, national law takes precedence. Any breach of this law carries severe penalties, including imprisonment for up to six months and fines reaching up toRs50,000, meant to serve as a deterrent against such grave infringements. As per theMultiple Indicator Cluster Survey (MICS) conducted in 2016-17, the prevalence of child marriages in Gilgit-Baltistan, especially in areas such as Chilas, Darel, Tangir, and Kharmang, stands alarmingly high, soaring to approximately 26pc. Despite concerted efforts to tackle the issue, including the introduction of legislation in 2015, progress has been hindered by opposition within the legislative assembly, leading to delays in its enactment. While the Child Marriage Restraint Act of 1929 is in place, its enforcement in these regions falls well short of the mark. And without a legal mandate imposing age restrictions, many see no obligation to adhere to the law. Subsequently, the absence of robust legislation and effective enforcement mechanisms perpetuates the cycle of child marriages, leaving the issue entirely unresolved. Child marriage is not merely a tradition; it has a direct bearing on human health and development. While marriage may bring a sense of satisfaction for many, it also entails significant responsibilities, demanding mental, physical, and financial preparedness. Experts argue that minors lack the maturity essential for a thriving marriage, posing potential health risks. We cannot afford the luxury of complacency while the innocence of our children is sacrificed at the altar of an archaic practice. It falls upon each of us, as guardians of our collective conscience, to demand comprehensive legislation that will dismantle the structures perpetuating child marriages. For the sake of our daughters and sons, for the preservation of their health, dignity, and dreams, we must act decisively. The time for rhetoric has passed; it is now time for action. Header image — taken from Reuters"
From screens to streets: How Gen Z is disrupting the status quo and redefining activism,https://www.dawn.com/news/1829562/from-screens-to-streets-how-gen-z-is-disrupting-the-status-quo-and-redefining-activism,It's safe to say that the kids are doing just fine. It is the adults running the world that are the problem.,"Soft. Entitled. Snowflakes. Lazy. These are some of the characterisations about Gen Z (those born between 1997 and 2012) pushed in the media by older generations who have largely failed to connect with and understand what they are all about. But these disparaging words used to describe the generation are, in fact, baseless — these young individuals are anything but passive. To put it simply, this generation isn’t waiting for change; they’re demanding it. Over the past six months alone, they’ve orchestrated movements that have sent shockwaves through the status quo, leaving elites squirming in discomfort. It’s time to recognise their power, their passion, and their potential to reshape our world that has been long ruined by decades of complacency. Pro-Palestinian students take part in a protest in support of the Palestinians amid the ongoing conflict in Gaza, at Columbia University in New York City, US, October 12, 2023 — Reuters We are seeing this play out atuniversity campuses across America, where administrators resort topolice interventionto suppress anti-war protests and encampments, only to witness a resounding backlash that reverberates far beyond their expectations. Tensions began to simmer on American university campuses soon after the terror attacks carried out by Hamas on October 7. As Israel continues to unleash an orgy of violence on Palestinians — the International Court of Justice has found it“plausible”that Israel is in violation of the Genocide Convention — the atmosphere on campuses has grown increasingly charged. Student groups have beensuspended,walkoutshave become increasingly common, and university towns havebecome the epicentreof the uncommitted campaign during the Democratic primary elections. A coalition of University of Michigan students rally at an encampment in the Diag to pressure the university to divest its endowment from companies that support Israel or could profit from the ongoing conflict on the University of Michigan college campus in Ann Arbor — Reuters Contrary to what the mainstream media would have you believe, the seething discontent isn’t confined to elite or progressive universities likeColumbiaandBerkeley. Thenumbers speak for themselves: one-third of adults under 30 say that their “sympathies lie either entirely or mostly with the Palestinian people (compared to 10 per cent or less for adults over 50), while 36pc of them believe that President Biden is “favouring Israelis too much” (compared to the 16pc or less for adults over 50). This has become a headache for Joe Biden, as he relies on thesupport of younger Americansto secure victory in the upcoming election in November. Demonstrators protest inside the Rockefeller Center asking for a ceasefire in the ongoing conflict between Israel and the Palestinian Islamist group Hamas, as President Joe Biden attends an interview in midtown Manhattan, in New York, February 26 — Reuters The ongoing conflict is yet another testament to Generation Z’s profound empathy and commitment to equity, inclusion, and human rights. According to anEdelman surveyspanning six countries, a staggering 70pc of Gen Z actively engages in social or political causes. What sets this generation apart is their digital fluency, enabling them to harness digital platforms, including decentralised media, to mobilise, educate, and advocate for change. Moreover,datashows that this generation watches the least amount of television, and prefers consuming content on platforms like TikTok (10.5 hours a week) and YouTube (6.9 hours a week). In fact, the fast-tracked nature of legislation seeking a TikTok ban in America is very much related to thefallout of the warin Gaza, and has unsurprisinglyangered young Americans. Students build a protest encampment in support of Palestinians, at the University of Southern California’s Alumni Park, amid the ongoing conflict, in Los Angeles, California, US, April 24, 2024 — Reuters Engage in conversation with older generations, and you’ll often hear the refrain: “Younger generations are out of touch, indifferent, and perpetually glued to their screens.” Yet, this worry overlooks a crucial truth. As digital natives, today’s youth possess an unparalleled ability to navigate the labyrinth of misinformation, actively seek out diverse perspectives, and circumvent traditional gatekeepers, particularly within the media landscape. Their digital prowess not only connects them to the pulse of reality but empowers them to shape it with unprecedented clarity and purpose. Most importantly, Gen Z is demonstrating an unwavering commitment to a host of global challenges, spanning from climate change and gender diversity to the plight of Palestine. It speaks of their values and sense of responsibility — something their parents and mentors should not only acknowledge but also take immense pride in. Greek university and high school students take part in a demonstration against a planned bill which opens the way for the operation of private universities, in Athens, Greece, January 11, 2024 — Reuters Demonstrators and students hit a wall as they shout slogans during a protest against the Chilean public education system and the results of the referendum on a new constitution, in Santiago, Chile September 6, 2022 — Reuters From Malala Yousafzai to Greta Thunberg — the emerging cohort of leaders, particularly women — is mobilising millions worldwide. For adults, especially those clinging onto institutions and power, this rising generation represents a threat. This is not only because of the fact that these leaders and organisers are speaking truth to power, but because they are seeking to dismantle the status quo in a bid to build something better and more inclusive. Moreover, the discomfort among established elites stems from their utter cluelessness in navigating the digital landscape wielded by younger generations. This new breed of leaders is not only adept at harnessing digital tools but also possesses a deep understanding of how to use them effectively, leaving the status quo scrambling to keep pace. Demonstrators take part in an “Emergency Rally: Stand with Palestinians Under Siege in Gaza,” amid the ongoing conflict between Israel and the Palestinian Islamist group Hamas, at Harvard University in Cambridge, Massachusetts, US, October 14, 2023 — Reuters The unfolding events across American universities serve as a stark reminder: nothing rattles status quo elites more than the sight of peaceful protestors courageously raising their voices. This has been consistently true across centuries. Yet, amid the turbulence, organisation and activism displayed by these students is inspiring next generation of leaders around the world. It’s safe to say that the kids are doing just fine. It is the adults running the world that are the problem."
"People with two copies of a risk gene have genetic form of Alzheimer’s, say scientists",https://www.dawn.com/news/1831980/people-with-two-copies-of-a-risk-gene-have-genetic-form-of-alzheimers-say-scientists,,"CHICAGO: Individuals carrying two copies of the APOE4 gene are ‘virtually guaranteed’ to develop Alzheimer’s and face symptoms at an earlier age, researchers told the international press on Monday. Thestudyis set to redefine such carriers as having a ‘new genetic form’ of the mind-wasting disease. The reclassification may change the current norms surrounding Alzheimer’s research, diagnosis and approaches to treatment, according to the researchers. The study waspublishedin the journalNature Medicine. “Through the data, we are saying that perhaps this is a genetic form of this disease, not merely a risk factor indication” the co-author of the study, Sterling Johnson, from the University of Wisconsin’s Alzheimer’s Disease Research Center told reporters at a press briefing.  Scientists have known for three decades that individuals with two copies of APOE4 gene variant, have a significantly higher risk of developing the disease, as compared to individuals with the most common version of the APOE gene, known as APOE3. About 2 to 3 per cent of the general population, or about 15 per cent of people with Alzheimer’s, have two copies of the APOE4 variant. “This study adds compelling data to suggest that people with two copies of this gene are almost guaranteed to develop Alzheimer’s if they live long enough, and that they will develop Alzheimer’s earlier than people without this gene,” stated professor Tara Spires-Jones, an Alzheimer’s researcher at the University of Edinburgh (Tara was not involved in the study). Dr. Juan Fortea and his colleagues, from the University of Barcelona conducted an in-depth study of more than 3,000 brains donated from the US National Alzheimer’s Coordinating Centre. They also delved into biological and clinical data on more than 10,000 individuals from five datasets in three countries. They found that by the age of 65, at least 95pc of people with two copies of APOE4, known as ‘homozygotes’, had abnormal levels of an Alzheimer’s-related protein termed ‘beta amyloid’ in their spinal fluid, while 75pc had positive brain scans for amyloid. Nearly all APOE4 homozygotes in the study had higher levels of amyloid at the age of 65 than people who were not carrying the risk variant. The findings suggest APOE4 homozygotes meet the three fundamental criteria for being a genetic disease. Firstly, almost all individuals with these two gene variants have Alzheimer’s biology, they all develop symptoms at about the same rate and clinical and biological changes occur in a sequence that may be predicted, the researchers stated. A Professor of the UCL Genetics Institute, namely David Curtis (who was not involved in the research), remained unconvinced of the findings. “I do not see anything in this paper to justify the claim that carrying two copies of APOE4 represents some ‘distinct genetic form’ of Alzheimer’s disease’,” he said in a statement. “No matter how many (copies) of APOE4 one carries the underlying disease processes seem similar across cases of Alzheimer’s disease” he said. The findings could have broader implications for the recently approved Alzheimer’s treatment ‘Leqembi’ by Eisai and Biogen. This a drug that reportedly removes amyloid from the brain. In clinical trials, patients with two copies of the APOE4 variant depicted much higher rates of brain bleeding and swelling associated with the treatment. In view of this, some centres shy away from treating these patients, Dr. Reisa Sperling, who worked on the study, stated at the press briefing. Published in Dawn, May 7th, 2024"
Editorial: What exactly is the objective of the new cybercrime agency that FIA could not achieve?,https://www.dawn.com/news/1831581,"The move will likely create redundancies and confusion, diluting the focus from actual cybercrime threats to the procedural chaos of transitioning to a new agency.","OUT of nowhere, the government haslauncheda new cybercrime authority: the National Cyber Crimes Investigation Agency. This move to replace the FIA’s cybercrime wing raises substantial concerns about the motive behind it. The NCCIA is mandated to handle offences under the Prevention of Electronic Crimes Act, which, activists allege, was used routinely by the FIA tosilence dissent. Of course, conversely, bad actors use social media to spread disinformation and misinformation, necessitating oversight.  But at a time when digital rights and privacy remain key issues for the state to address, the authorities have opted to forgo any meaningful dialogue with digital rights groups, the IT sector, or even the public. Such an opaque approach fosters distrust and scepticism towards the government’s intentions. It has neither presented a clear rationale nor demonstrated the deficiencies within the existing framework that necessitated this move. The reuse of the FIA’s resources — personnel, assets, and existing cases — under a new banner raises a fundamental question: what exactly is the objective of the NCCIA that the FIA could not achieve? If the goal was to enhance capabilities or streamline operations, would it not have been more prudent to bolster the existing framework rather than dismantle it? The abruptness of the move suggests the new rulers are not behind it. The move will likely create redundancies and confusion, diluting the focus from actual cybercrime threats to the procedural chaos of transitioning to a new agency. Also, such disruptions could hinder ongoing operations and complicate international cooperation under links nurtured by the FIA.  Furthermore, the NCCIA, with its broad and unclear mandate, could potentially lead to increased surveillance and data collection practices, encroaching upon the personal liberties of citizens under the guise of security. It appears the PML-N government is working in the same manner as when Peca was beingpromulgated, when no input was taken. The situation has called into question the regulatory environment for the internet in the coming years. Ostensibly, the aim is to exert greater control over social media and to gain more power to crack down on activists, dissidents and journalists critical of state policies. The government owes the public an explanation of the necessity and aims of the NCCIA. It must articulate how this new set-up will better serve the cybersecurity needs of the nation without compromising democratic freedoms. It is also crucial that further developments in this area involve a broad spectrum of stakeholders. Engaging with experts in digital rights, cybersecurity, the legal domain, and the public is essential to ensure that the agency’s operations are balanced, effective, and respectful of the rights it is purportedly designed to protect. The urge to police social media must be resisted. Published in Dawn, May 5th, 2024"
